outputs/exploratory/861_global_depth_mask/full/tables/metrics_by_cell.csv

fold_id,seed,rho,method,rmse_depth,mae_depth,n_observed,n_holdout,n_test_windows,n_empty_windows,multiplicity_min,multiplicity_max,lambda
0.0,7.0,0.25,clp_csgm_ridge,0.027432913974585253,0.024261051606835584,7.0,22.0,22.0,0.0,1.0,8.0,0.0001
0.0,7.0,0.25,csgm_unconditioned,0.020957690798654546,0.017811373656058064,7.0,22.0,22.0,0.0,1.0,8.0,
0.0,7.0,0.25,ae_regression_ub,0.02966274970640986,0.026042744397907415,7.0,22.0,22.0,0.0,1.0,8.0,
0.0,7.0,0.25,prior_only,0.049294286927311644,0.044004041052652446,7.0,22.0,22.0,0.0,1.0,8.0,
0.0,7.0,0.25,depth_interpolation,0.018693662234128463,0.015960666208859088,7.0,22.0,22.0,0.0,1.0,8.0,
0.0,7.0,0.5,clp_csgm_ridge,0.028042817780825013,0.02474601774393894,14.0,15.0,22.0,0.0,1.0,8.0,0.0003
0.0,7.0,0.5,csgm_unconditioned,0.02158393194050136,0.01841878591874992,14.0,15.0,22.0,0.0,1.0,8.0,
0.0,7.0,0.5,ae_regression_ub,0.02977849731727537,0.026108382402052953,14.0,15.0,22.0,0.0,1.0,8.0,
0.0,7.0,0.5,prior_only,0.051412369452271775,0.046804945406179785,14.0,15.0,22.0,0.0,1.0,8.0,
0.0,7.0,0.5,depth_interpolation,0.017748502494657106,0.015346392111236066,14.0,15.0,22.0,0.0,1.0,8.0,
0.0,23.0,0.25,clp_csgm_ridge,0.028868657750969,0.02398317808813466,7.0,22.0,22.0,0.0,1.0,8.0,0.0001
0.0,23.0,0.25,csgm_unconditioned,0.028012926190076726,0.019355821954351548,7.0,22.0,22.0,0.0,1.0,8.0,
0.0,23.0,0.25,ae_regression_ub,0.03998486789304346,0.03576315017275158,7.0,22.0,22.0,0.0,1.0,8.0,
0.0,23.0,0.25,prior_only,0.04743608709516645,0.04131903497723963,7.0,22.0,22.0,0.0,1.0,8.0,
0.0,23.0,0.25,depth_interpolation,0.021412948005457386,0.016175698158051866,7.0,22.0,22.0,0.0,1.0,8.0,
0.0,23.0,0.5,clp_csgm_ridge,0.023231604919270007,0.018385958315614976,14.0,15.0,22.0,0.0,1.0,8.0,0.0001
0.0,23.0,0.5,csgm_unconditioned,0.024742111314269035,0.01906044872759822,14.0,15.0,22.0,0.0,1.0,8.0,
0.0,23.0,0.5,ae_regression_ub,0.030533872018452368,0.025957858583496682,14.0,15.0,22.0,0.0,1.0,8.0,
0.0,23.0,0.5,prior_only,0.042356379447798465,0.03492666501417737,14.0,15.0,22.0,0.0,1.0,8.0,
0.0,23.0,0.5,depth_interpolation,0.023947435855960163,0.01919782135076338,14.0,15.0,22.0,0.0,1.0,8.0,
0.0,41.0,0.25,clp_csgm_ridge,0.03352814214681063,0.0296884007386024,7.0,22.0,22.0,0.0,1.0,8.0,0.0001
0.0,41.0,0.25,csgm_unconditioned,0.027425701277920107,0.022502267477997186,7.0,22.0,22.0,0.0,1.0,8.0,
0.0,41.0,0.25,ae_regression_ub,0.0316755244692215,0.026909357823721777,7.0,22.0,22.0,0.0,1.0,8.0,
0.0,41.0,0.25,prior_only,0.04165951274658371,0.035823690784450454,7.0,22.0,22.0,0.0,1.0,8.0,
0.0,41.0,0.25,depth_interpolation,0.020406677818594194,0.016065890629069005,7.0,22.0,22.0,0.0,1.0,8.0,
0.0,41.0,0.5,clp_csgm_ridge,0.02387461199708931,0.020851979668308,14.0,15.0,22.0,0.0,1.0,8.0,0.0001
0.0,41.0,0.5,csgm_unconditioned,0.015259938142744262,0.013180681665976182,14.0,15.0,22.0,0.0,1.0,8.0,
0.0,41.0,0.5,ae_regression_ub,0.0324386689027909,0.028000534145983434,14.0,15.0,22.0,0.0,1.0,8.0,
0.0,41.0,0.5,prior_only,0.04452806599816792,0.04030373617915649,14.0,15.0,22.0,0.0,1.0,8.0,
0.0,41.0,0.5,depth_interpolation,0.016719193777515403,0.014328796264815676,14.0,15.0,22.0,0.0,1.0,8.0,
1.0,7.0,0.25,clp_csgm_ridge,0.0451292988234835,0.030444506332040565,7.0,22.0,22.0,0.0,1.0,8.0,0.0001
1.0,7.0,0.25,csgm_unconditioned,0.046313200589419554,0.03231809783210866,7.0,22.0,22.0,0.0,1.0,8.0,
1.0,7.0,0.25,ae_regression_ub,0.05333375208562262,0.03629172195939275,7.0,22.0,22.0,0.0,1.0,8.0,
1.0,7.0,0.25,prior_only,0.04935316751187247,0.03579328865879242,7.0,22.0,22.0,0.0,1.0,8.0,
1.0,7.0,0.25,depth_interpolation,0.04082531259937751,0.02917307900432917,7.0,22.0,22.0,0.0,1.0,8.0,
1.0,7.0,0.5,clp_csgm_ridge,0.051336607921890064,0.0360708899605912,14.0,15.0,22.0,0.0,1.0,8.0,0.0001
1.0,7.0,0.5,csgm_unconditioned,0.05189586665135307,0.03717128118594101,14.0,15.0,22.0,0.0,1.0,8.0,
1.0,7.0,0.5,ae_regression_ub,0.06118649331287967,0.04409625045744673,14.0,15.0,22.0,0.0,1.0,8.0,
1.0,7.0,0.5,prior_only,0.057013092280122295,0.04320411162947577,14.0,15.0,22.0,0.0,1.0,8.0,
1.0,7.0,0.5,depth_interpolation,0.04223547389083964,0.03259659773870614,14.0,15.0,22.0,0.0,1.0,8.0,
1.0,23.0,0.25,clp_csgm_ridge,0.04348805302880665,0.03227137662137757,7.0,22.0,22.0,4.0,1.0,8.0,0.0001
1.0,23.0,0.25,csgm_unconditioned,0.04342666457654842,0.030815109199639364,7.0,22.0,22.0,4.0,1.0,8.0,
1.0,23.0,0.25,ae_regression_ub,0.046939237979026494,0.03499551978023538,7.0,22.0,22.0,4.0,1.0,8.0,
1.0,23.0,0.25,prior_only,0.04669622412656703,0.03509049391203598,7.0,22.0,22.0,4.0,1.0,8.0,
1.0,23.0,0.25,depth_interpolation,0.055873015503609166,0.046437973484848565,7.0,22.0,22.0,4.0,1.0,8.0,
1.0,23.0,0.5,clp_csgm_ridge,0.03545581295281296,0.02582433344376347,14.0,15.0,22.0,0.0,1.0,8.0,0.0001
1.0,23.0,0.5,csgm_unconditioned,0.039005871773895716,0.03339729432023012,14.0,15.0,22.0,0.0,1.0,8.0,
1.0,23.0,0.5,ae_regression_ub,0.04307883451225291,0.03290186174843046,14.0,15.0,22.0,0.0,1.0,8.0,
1.0,23.0,0.5,prior_only,0.044103894651957964,0.033635565796708684,14.0,15.0,22.0,0.0,1.0,8.0,
1.0,23.0,0.5,depth_interpolation,0.02864561523083373,0.024570735930735797,14.0,15.0,22.0,0.0,1.0,8.0,
1.0,41.0,0.25,clp_csgm_ridge,0.04640953130248866,0.03358317284479906,7.0,22.0,22.0,0.0,1.0,8.0,0.0001
1.0,41.0,0.25,csgm_unconditioned,0.04314211040270961,0.030924283981683783,7.0,22.0,22.0,0.0,1.0,8.0,
1.0,41.0,0.25,ae_regression_ub,0.05196299293720706,0.037066695638452524,7.0,22.0,22.0,0.0,1.0,8.0,
1.0,41.0,0.25,prior_only,0.04905389147826715,0.03612292880437513,7.0,22.0,22.0,0.0,1.0,8.0,
1.0,41.0,0.25,depth_interpolation,0.038771456639203006,0.029765449438204406,7.0,22.0,22.0,0.0,1.0,8.0,
1.0,41.0,0.5,clp_csgm_ridge,0.04316043234545543,0.030342336182138035,14.0,15.0,22.0,0.0,1.0,8.0,0.1
1.0,41.0,0.5,csgm_unconditioned,0.031744296538660996,0.026051514165311113,14.0,15.0,22.0,0.0,1.0,8.0,
1.0,41.0,0.5,ae_regression_ub,0.045598385819582365,0.030555520486287655,14.0,15.0,22.0,0.0,1.0,8.0,
1.0,41.0,0.5,prior_only,0.04319239383485097,0.030366996918365276,14.0,15.0,22.0,0.0,1.0,8.0,
1.0,41.0,0.5,depth_interpolation,0.03358733587485081,0.027425748792269913,14.0,15.0,22.0,0.0,1.0,8.0,
2.0,7.0,0.25,clp_csgm_ridge,0.08672744258773035,0.06896078635999962,7.0,22.0,22.0,3.0,1.0,8.0,0.0001
2.0,7.0,0.25,csgm_unconditioned,0.06155559218591972,0.05019356668213837,7.0,22.0,22.0,3.0,1.0,8.0,
2.0,7.0,0.25,ae_regression_ub,0.0684158314503579,0.05771639396501826,7.0,22.0,22.0,3.0,1.0,8.0,
2.0,7.0,0.25,prior_only,0.09398232401398829,0.07965817783313606,7.0,22.0,22.0,3.0,1.0,8.0,
2.0,7.0,0.25,depth_interpolation,0.03405211195062573,0.026968868921775645,7.0,22.0,22.0,3.0,1.0,8.0,
2.0,7.0,0.5,clp_csgm_ridge,0.1003054956089914,0.09026757654412029,14.0,15.0,22.0,0.0,1.0,8.0,0.001
2.0,7.0,0.5,csgm_unconditioned,0.061235193297759706,0.055030907153603065,14.0,15.0,22.0,0.0,1.0,8.0,
2.0,7.0,0.5,ae_regression_ub,0.07754364772865846,0.0713614501088621,14.0,15.0,22.0,0.0,1.0,8.0,
2.0,7.0,0.5,prior_only,0.10564132323134176,0.09529646985491015,14.0,15.0,22.0,0.0,1.0,8.0,
2.0,7.0,0.5,depth_interpolation,0.032368404027571074,0.027983617571056787,14.0,15.0,22.0,0.0,1.0,8.0,
2.0,23.0,0.25,clp_csgm_ridge,0.056939279684173734,0.04401852203452517,7.0,22.0,22.0,0.0,1.0,8.0,0.0001
2.0,23.0,0.25,csgm_unconditioned,0.039196212353918486,0.030790158056069196,7.0,22.0,22.0,0.0,1.0,8.0,
2.0,23.0,0.25,ae_regression_ub,0.06204180519111642,0.04861161642147478,7.0,22.0,22.0,0.0,1.0,8.0,
2.0,23.0,0.25,prior_only,0.09234264750653327,0.07326180766134681,7.0,22.0,22.0,0.0,1.0,8.0,
2.0,23.0,0.25,depth_interpolation,0.04683939795982294,0.04061798280770218,7.0,22.0,22.0,0.0,1.0,8.0,
2.0,23.0,0.5,clp_csgm_ridge,0.05348341609221754,0.04332984655085897,14.0,15.0,22.0,0.0,1.0,8.0,0.0001
2.0,23.0,0.5,csgm_unconditioned,0.036063892900286186,0.029338581554772515,14.0,15.0,22.0,0.0,1.0,8.0,
2.0,23.0,0.5,ae_regression_ub,0.06434472854591788,0.05110361361735397,14.0,15.0,22.0,0.0,1.0,8.0,
2.0,23.0,0.5,prior_only,0.09688683832300386,0.07745060501221963,14.0,15.0,22.0,0.0,1.0,8.0,
2.0,23.0,0.5,depth_interpolation,0.04304897306328645,0.03415986790986783,14.0,15.0,22.0,0.0,1.0,8.0,
2.0,41.0,0.25,clp_csgm_ridge,0.08529666978213131,0.07516096470709857,7.0,22.0,22.0,0.0,1.0,8.0,0.1
2.0,41.0,0.25,csgm_unconditioned,0.06794796395205879,0.058225707576035825,7.0,22.0,22.0,0.0,1.0,8.0,
2.0,41.0,0.25,ae_regression_ub,0.0732992242083701,0.06264711199616972,7.0,22.0,22.0,0.0,1.0,8.0,
2.0,41.0,0.25,prior_only,0.0853059809341838,0.07516678476893392,7.0,22.0,22.0,0.0,1.0,8.0,
2.0,41.0,0.25,depth_interpolation,0.04261605451076053,0.03428881716100482,7.0,22.0,22.0,0.0,1.0,8.0,
2.0,41.0,0.5,clp_csgm_ridge,0.0913551183388121,0.0792943381915259,14.0,15.0,22.0,0.0,2.0,8.0,0.1
2.0,41.0,0.5,csgm_unconditioned,0.08195534210253093,0.06403679512541262,14.0,15.0,22.0,0.0,2.0,8.0,
2.0,41.0,0.5,ae_regression_ub,0.07203426284331134,0.06269552185127422,14.0,15.0,22.0,0.0,2.0,8.0,
2.0,41.0,0.5,prior_only,0.09134374254247012,0.07929180118543765,14.0,15.0,22.0,0.0,2.0,8.0,
2.0,41.0,0.5,depth_interpolation,0.029810006981429504,0.025117032009382086,14.0,15.0,22.0,0.0,2.0,8.0,

outputs/exploratory/861_global_depth_mask/pilot/REPORT.md

## Depth RMSE

Fraction 0.25:
- clp_csgm_ridge: RMSE 0.0274 , MAE 0.0243 , lambda 0.0001
- csgm_unconditioned: RMSE 0.0210 , MAE 0.0178 , lambda none
- ae_regression_ub: RMSE 0.0297 , MAE 0.0260 , lambda none
- prior_only: RMSE 0.0493 , MAE 0.0440 , lambda none
- depth_interpolation: RMSE 0.0187 , MAE 0.0160 , lambda none

Fraction 0.5:
- clp_csgm_ridge: RMSE 0.0280 , MAE 0.0247 , lambda 0.0003
- csgm_unconditioned: RMSE 0.0216 , MAE 0.0184 , lambda none
- ae_regression_ub: RMSE 0.0298 , MAE 0.0261 , lambda none
- prior_only: RMSE 0.0514 , MAE 0.0468 , lambda none
- depth_interpolation: RMSE 0.0177 , MAE 0.0153 , lambda none